{
  "id": "snap_018f3c8e9b2a7c4d8f1e2a3b4c5d6e7f",
  "captured_at": "2026-06-10T14:30:00Z",
  "objects": [],
  "affect": {
    "source_kind": "live_observation",
    "observed_at": "2026-06-10T14:29:00Z",
    "dimensions": {
      "energy": {
        "dimension": "energy",
        "direction": "higher_is_better",
        "value": 4.5,
        "scale": {
          "min": 0,
          "max": 10
        },
        "threshold": {
          "warning_delta": 1.5,
          "critical_delta": 0.5
        },
        "freshness_seconds": 900
      },
      "stress": {
        "dimension": "stress",
        "direction": "lower_is_better",
        "value": 6.5,
        "scale": {
          "min": 0,
          "max": 10
        },
        "threshold": {
          "warning_delta": 1.5,
          "critical_delta": 0.5
        },
        "freshness_seconds": 900
      },
      "mood_intensity": {
        "dimension": "mood_intensity",
        "direction": "higher_is_better",
        "value": 7.0,
        "scale": {
          "min": 0,
          "max": 10
        },
        "threshold": {
          "warning_delta": 1.5,
          "critical_delta": 0.5
        },
        "freshness_seconds": 900
      }
    }
  }
}
